{
  "$schema": "https://json-schema.org/draft/2020-12/schema",
  "title": "Pi Harness marketplace entry",
  "description": "Structural contract for one JSON file under packages/api-gateway/src/marketplace-entries. It mirrors isMarketplacePlugin in packages/api-gateway/src/marketplace.ts, which is the authoritative validator and runs when the API gateway module is imported. Two rules cannot be expressed here and are enforced only at runtime: profile.name must equal packageName, and every entry sharing a category id must spell its label the same way.",
  "type": "object",
  "required": [
    "id",
    "packageName",
    "version",
    "name",
    "description",
    "author",
    "repository",
    "license",
    "source",
    "status",
    "category",
    "capabilities",
    "hooks",
    "profile"
  ],
  "additionalProperties": false,
  "allOf": [
    {
      "if": { "required": ["capabilities"], "properties": { "capabilities": { "contains": { "const": "read-only" } } } },
      "then": {
        "properties": {
          "capabilities": {
            "not": { "contains": { "enum": ["writes-files", "runs-commands", "local-server", "network-access", "model-calls"] } }
          }
        }
      }
    }
  ],
  "properties": {
    "id": { "type": "string", "pattern": "^[a-z0-9]+(?:-[a-z0-9]+)*$" },
    "packageName": { "type": "string", "pattern": "^(?:@[a-z0-9._~-]+/)?[a-z0-9._~-]+(?:/[a-z0-9._~-]+)*$" },
    "version": { "type": "string", "pattern": "^[0-9]+\\.[0-9]+\\.[0-9]+(?:-[0-9A-Za-z.-]+)?$" },
    "name": { "type": "string", "pattern": "\\S" },
    "description": { "type": "string", "pattern": "\\S" },
    "author": { "type": "string", "pattern": "\\S" },
    "repository": { "type": "string", "pattern": "^https://" },
    "license": { "type": "string", "pattern": "\\S" },
    "source": { "enum": ["official", "community"] },
    "status": { "enum": ["verified", "experimental"] },
    "category": {
      "type": "object",
      "required": ["id", "label"],
      "additionalProperties": false,
      "properties": { "id": { "type": "string", "pattern": "^[a-z0-9]+(?:-[a-z0-9]+)*$" }, "label": { "type": "string", "pattern": "\\S" } }
    },
    "capabilities": {
      "type": "array",
      "items": {
        "enum": ["read-only", "session-data", "reads-files", "writes-files", "runs-commands", "local-server", "network-access", "model-calls"]
      },
      "minItems": 1,
      "uniqueItems": true
    },
    "hooks": { "type": "array", "items": { "type": "string", "pattern": "\\S" }, "minItems": 1, "uniqueItems": true },
    "dependencies": {
      "type": "array",
      "items": { "type": "string", "pattern": "^[a-z0-9]+(?:-[a-z0-9]+)*$" },
      "minItems": 1,
      "uniqueItems": true
    },
    "profile": {
      "type": "object",
      "required": ["name", "config"],
      "additionalProperties": false,
      "properties": { "name": { "type": "string", "pattern": "\\S" }, "group": { "type": "boolean" }, "config": { "type": ["object", "array"] } },
      "if": { "properties": { "group": { "const": true } }, "required": ["group"] },
      "then": { "properties": { "config": { "type": "array" } } },
      "else": { "properties": { "config": { "type": "object" } } }
    },
    "statistics": {
      "type": "object",
      "additionalProperties": false,
      "properties": {
        "downloads30d": { "type": "integer", "minimum": 0 },
        "quality": { "type": "number", "minimum": 0, "maximum": 1 },
        "updatedAt": { "type": "string", "pattern": "\\S" }
      }
    }
  }
}
