{
  "id": "colleague-skill",
  "packageName": "@pi-harness/plugin-colleague-skill",
  "version": "0.1.31",
  "name": "Colleague Skill",
  "description": "为另一个角色生成结构化的交接包，不会隐式启动 agent，也不会代发消息。",
  "author": "Pi Harness",
  "repository": "https://github.com/pi-harness/pi-harness",
  "license": "MIT",
  "source": "official",
  "status": "verified",
  "category": {
    "id": "workflow",
    "label": "工作流"
  },
  "capabilities": ["read-only", "session-data"],
  "hooks": ["会话存储", "插件面板"],
  "profile": {
    "name": "@pi-harness/plugin-colleague-skill",
    "config": {}
  }
}
