{
  "id": "runtime-doctor",
  "packageName": "@pi-harness/plugin-runtime-doctor",
  "version": "0.1.31",
  "name": "Runtime Doctor",
  "description": "一次只读体检：工作区、agent 目录、模型、运行时、MCP 服务和插件错误。",
  "author": "Pi Harness",
  "repository": "https://github.com/pi-harness/pi-harness",
  "license": "MIT",
  "source": "official",
  "status": "verified",
  "category": {
    "id": "developer",
    "label": "开发工具"
  },
  "capabilities": ["read-only", "session-data", "reads-files"],
  "hooks": ["文件系统检查", "运行时服务", "插件错误", "插件面板"],
  "profile": {
    "name": "@pi-harness/plugin-runtime-doctor",
    "config": {}
  }
}
