{
  "id": "session-bridge",
  "packageName": "@pi-harness/plugin-session-bridge",
  "version": "0.1.33",
  "name": "Session Bridge",
  "description": "预览并导出会话交接包；导入需要确认，包体经过严格校验并防重复注入。",
  "author": "Pi Harness",
  "repository": "https://github.com/pi-harness/pi-harness",
  "license": "MIT",
  "source": "official",
  "status": "verified",
  "category": {
    "id": "workflow",
    "label": "工作流"
  },
  "capabilities": ["session-data", "writes-files"],
  "hooks": ["会话桥接工具", "当前会话管理器", "自定义上下文消息", "插件面板"],
  "profile": {
    "name": "@pi-harness/plugin-session-bridge",
    "config": {}
  }
}
