{
  "id": "agent-teams",
  "packageName": "@pi-harness/plugin-agent-teams",
  "version": "0.1.33",
  "name": "Agent Team Board",
  "description": "在当前会话内维护一份角色、任务依赖与留言板，不会额外启动 agent，也不会对外发消息。",
  "author": "Pi Harness",
  "repository": "https://github.com/pi-harness/pi-harness",
  "license": "MIT",
  "source": "official",
  "status": "verified",
  "category": {
    "id": "workflow",
    "label": "工作流"
  },
  "capabilities": ["read-only", "session-data"],
  "hooks": ["会话生命周期", "插件面板"],
  "profile": {
    "name": "@pi-harness/plugin-agent-teams",
    "config": {}
  }
}
