{
  "id": "archify",
  "packageName": "@pi-harness/plugin-archify",
  "version": "0.1.33",
  "name": "Architecture Map",
  "description": "从工作区的模块和依赖清单生成一张只读的架构图。",
  "author": "Pi Harness",
  "repository": "https://github.com/pi-harness/pi-harness",
  "license": "MIT",
  "source": "official",
  "status": "verified",
  "category": {
    "id": "developer",
    "label": "开发工具"
  },
  "capabilities": ["reads-files", "runs-commands"],
  "hooks": ["工作区文件", "依赖清单", "插件面板"],
  "profile": {
    "name": "@pi-harness/plugin-archify",
    "config": {}
  }
}
