{
  "id": "openpets",
  "packageName": "@pi-harness/plugin-openpets",
  "version": "0.1.31",
  "name": "OpenPets",
  "description": "根据最近的会话事件维护一只桌面宠物的状态，不保存消息内容，操作受限且持久化状态可见。",
  "author": "Pi Harness",
  "repository": "https://github.com/pi-harness/pi-harness",
  "license": "MIT",
  "source": "official",
  "status": "verified",
  "category": {
    "id": "web",
    "label": "网页与研究"
  },
  "capabilities": ["read-only", "session-data"],
  "hooks": ["会话事件", "宠物反应工具", "会话存储", "插件面板"],
  "profile": {
    "name": "@pi-harness/plugin-openpets",
    "config": {}
  }
}
