{
  "id": "mcp-client",
  "packageName": "@pi-harness/plugin-mcp-client",
  "version": "0.1.32",
  "name": "MCP Client",
  "description": "连接 argv 直启的 MCP stdio 服务，桥接它的工具、资源与提示词，请求排队可取消，进程随生命周期回收。",
  "author": "Pi Harness",
  "repository": "https://github.com/pi-harness/pi-harness",
  "license": "MIT",
  "source": "official",
  "status": "verified",
  "category": {
    "id": "developer",
    "label": "开发工具"
  },
  "capabilities": ["runs-commands"],
  "hooks": ["MCP stdio 工具", "托管服务进程", "插件面板"],
  "profile": {
    "name": "@pi-harness/plugin-mcp-client",
    "config": {
      "servers": []
    }
  }
}
