{
  "id": "cordis-timer",
  "packageName": "@deepseek-ai/cordis-plugin-timer",
  "version": "1.1.3",
  "name": "Timer",
  "description": "Provides bounded lifecycle-owned scheduling with async intervals, throttling, and debouncing.",
  "author": "DeepSeek AI",
  "repository": "https://github.com/deepseek-ai/deepseek-harness",
  "license": "MIT",
  "source": "official",
  "status": "verified",
  "category": { "id": "runtime", "label": "运行时" },
  "capabilities": ["read-only"],
  "hooks": ["Cordis timer service", "plugin UI"],
  "profile": { "name": "@deepseek-ai/cordis-plugin-timer", "config": {} }
}
