{
  "id": "llm-verifier",
  "packageName": "@pi-harness/plugin-llm-verifier",
  "version": "0.1.31",
  "name": "LLM Verifier",
  "description": "让指定的校验模型对着有上限的证据判断一条结论是否成立。",
  "author": "Pi Harness",
  "repository": "https://github.com/pi-harness/pi-harness",
  "license": "MIT",
  "source": "official",
  "status": "verified",
  "category": {
    "id": "developer",
    "label": "开发工具"
  },
  "capabilities": ["model-calls"],
  "hooks": ["模型运行时", "结构化结论", "插件面板"],
  "profile": {
    "name": "@pi-harness/plugin-llm-verifier",
    "config": {}
  }
}
