{
  "id": "dependency-checker",
  "packageName": "@pi-harness/plugin-dependency-checker",
  "version": "0.1.32",
  "name": "Dependency Checker",
  "description": "离线只读检查工作区的 package.json 与 requirements*.txt：本地是否已安装、重复声明是否一致、约束能否解析。",
  "author": "Pi Harness",
  "repository": "https://github.com/pi-harness/pi-harness",
  "license": "MIT",
  "source": "official",
  "status": "verified",
  "category": {
    "id": "developer",
    "label": "开发工具"
  },
  "capabilities": ["read-only", "reads-files"],
  "hooks": ["依赖检查工具", "工作区清单读取", "插件面板"],
  "profile": {
    "name": "@pi-harness/plugin-dependency-checker",
    "config": {}
  }
}
