{
  "id": "annotation",
  "packageName": "@pi-harness/plugin-annotation",
  "version": "0.1.32",
  "name": "Annotations",
  "description": "把对话里选中的片段和批注存下来，作为后续对话的上下文。",
  "author": "Pi Harness",
  "repository": "https://github.com/pi-harness/pi-harness",
  "license": "MIT",
  "source": "official",
  "status": "verified",
  "category": {
    "id": "context",
    "label": "上下文管理"
  },
  "capabilities": ["read-only"],
  "hooks": ["插件面板"],
  "profile": {
    "name": "@pi-harness/plugin-annotation",
    "config": {}
  }
}
