{
  "id": "synapse",
  "packageName": "@pi-harness/plugin-synapse",
  "version": "0.1.33",
  "name": "Synapse",
  "description": "把会话之间的关联和相关工作项画出来，不改动对话记录。",
  "author": "Pi Harness",
  "repository": "https://github.com/pi-harness/pi-harness",
  "license": "MIT",
  "source": "official",
  "status": "verified",
  "category": {
    "id": "context",
    "label": "上下文管理"
  },
  "capabilities": ["read-only", "session-data"],
  "hooks": ["会话事件", "插件面板"],
  "profile": {
    "name": "@pi-harness/plugin-synapse",
    "config": {}
  }
}
