{
  "id": "memory",
  "packageName": "@pi-harness/plugin-memory",
  "version": "0.1.33",
  "name": "Memory",
  "description": "跨会话保存有上限的笔记，支持显式的回忆与更新。",
  "author": "Pi Harness",
  "repository": "https://github.com/pi-harness/pi-harness",
  "license": "MIT",
  "source": "official",
  "status": "verified",
  "category": {
    "id": "context",
    "label": "上下文管理"
  },
  "capabilities": ["reads-files", "writes-files"],
  "hooks": ["会话生命周期", "插件面板"],
  "profile": {
    "name": "@pi-harness/plugin-memory",
    "config": {}
  }
}
