{
  "id": "module-search",
  "packageName": "@pi-harness/plugin-module-search",
  "version": "0.1.33",
  "name": "Module Search",
  "description": "在工作区源码里查找 import、export 和已声明的符号，只读不改。",
  "author": "Pi Harness",
  "repository": "https://github.com/pi-harness/pi-harness",
  "license": "MIT",
  "source": "official",
  "status": "verified",
  "category": {
    "id": "discovery",
    "label": "发现与生态"
  },
  "capabilities": ["read-only", "reads-files"],
  "hooks": ["工作区文件", "源码扫描", "插件面板"],
  "profile": {
    "name": "@pi-harness/plugin-module-search",
    "config": {}
  }
}
